{
  "authority_files": {
    "microtask_contract_glob": ".GOV/task_packets/WP-1-Structured-Collaboration-Schema-Registry-v4/MT-*.json",
    "packet_contract": ".GOV/task_packets/WP-1-Structured-Collaboration-Schema-Registry-v4/packet.json",
    "packet_projection": ".GOV/task_packets/WP-1-Structured-Collaboration-Schema-Registry-v4/packet.md",
    "refinement_contract": ".GOV/task_packets/WP-1-Structured-Collaboration-Schema-Registry-v4/refinement.json"
  },
  "base_wp_id": "WP-1-Structured-Collaboration-Schema-Registry",
  "contract_authority": "PRIMARY_MACHINE_READABLE",
  "created_at_utc": "2026-03-24T22:39:44.996Z",
  "lifecycle": {
    "current_main_compatibility_status": "",
    "main_containment_status": "",
    "packet_format_version": "2026-03-23",
    "risk_tier": "HIGH",
    "status": "Validated (PASS)",
    "user_signature": "ilja240320262335"
  },
  "markdown_projection": {
    "generated_at_utc": "2026-05-06T15:01:56.170Z",
    "generator": "wp-contract-import.mjs",
    "path": ".GOV/task_packets/WP-1-Structured-Collaboration-Schema-Registry-v4/packet.md",
    "projection_hash": "54f0503cafbba75e",
    "source_file": ".GOV/task_packets/WP-1-Structured-Collaboration-Schema-Registry-v4/packet.json",
    "source_hash": "1e63f0057c587823",
    "status": "GENERATED_IN_SYNC"
  },
  "microtasks": {
    "active_id": null,
    "contract_glob": ".GOV/task_packets/WP-1-Structured-Collaboration-Schema-Registry-v4/MT-*.json",
    "declared_ids": [],
    "next_id": null
  },
  "red_team": {
    "assumptions_to_attack": [
      "Imported legacy Markdown may contain shadow authority that the first-pass contract did not capture.",
      "Projection hash repair proves file identity, not semantic completeness.",
      "Consumers must treat LEGACY_AUTHORITY as migration debt until reviewed or regenerated."
    ],
    "minimum_controls": [
      "Prefer primary JSON once imported.",
      "Keep generated projection hashes fail-closed.",
      "Record unsupported fallback fields as RGF migration debt."
    ],
    "profile": "DETERMINISTIC_CONTRACT_MIGRATION_V1",
    "required": true
  },
  "refinement": {
    "activation_manager_required": true,
    "contract_file": ".GOV/task_packets/WP-1-Structured-Collaboration-Schema-Registry-v4/refinement.json",
    "enforcement_profile": "HYDRATED_RESEARCH_V1",
    "hydration_profile": "HYDRATED_RESEARCH_V1",
    "status": "SIGNED_OR_LEGACY"
  },
  "schema_id": "hsk.work_packet_contract@1",
  "schema_version": "work_packet_contract_v1",
  "scope": {
    "acceptance_criteria": [],
    "allowed_paths": [
      "- src/backend/handshake_core/src/locus/types.rs"
    ],
    "forbidden_paths": [
      "- Loom storage portability and database-backend abstraction work"
    ],
    "spec_anchors": [
      "Handshake_Master_Spec_v02.178.md Base structured schema and project-profile extension contract [ADD v02.168]"
    ],
    "summary": "Harden the shared structured-collaboration validator so Work Packet, Micro-Task, Task Board, and Role Mailbox records enforce portable workflow-state fields, recursively validate nested payload elements, and reject malformed RFC3339 timestamps, artifact-handle strings, and sha256 strings with validator-owned negative-path proof.",
    "why": "The v3 smoke-test lane already improved emitters and happy-path outputs, but audit against the current Master Spec proved closure incomplete. The remaining gap is central validator strictness and adversarial proof, not new record families."
  },
  "source_control": {
    "canonical_branch": "main",
    "merge_base_sha": "facce56f879d4ee990f62566b12a8b26d8bc61d7 (git merge-base main HEAD at creation time; use for deterministic `just post-work --range` evidence)",
    "remote_backup_branch": "feat/WP-1-Structured-Collaboration-Schema-Registry-v4",
    "work_branch": "feat/WP-1-Structured-Collaboration-Schema-Registry-v4",
    "worktree_dir": "../wtc-schema-registry-v4"
  },
  "updated_at_utc": null,
  "workflow": {
    "authority": "ORCHESTRATOR",
    "communication_contract": "DIRECT_REVIEW_V1",
    "communication_dir": "../gov_runtime/roles_shared/WP_COMMUNICATIONS/WP-1-Structured-Collaboration-Schema-Registry-v4",
    "execution_owner": "CODER_A",
    "host_preference": "HANDSHAKE_ACP_BROKER",
    "lane": "ORCHESTRATOR_MANAGED",
    "receipts_file": "../gov_runtime/roles_shared/WP_COMMUNICATIONS/WP-1-Structured-Collaboration-Schema-Registry-v4/RECEIPTS.jsonl",
    "runtime_status_file": "../gov_runtime/roles_shared/WP_COMMUNICATIONS/WP-1-Structured-Collaboration-Schema-Registry-v4/RUNTIME_STATUS.json",
    "session_start_authority": "ORCHESTRATOR_ONLY"
  },
  "wp_id": "WP-1-Structured-Collaboration-Schema-Registry-v4"
}
